{
  "contractVersion": "mere.run/plugin-catalog.v1",
  "updatedAt": "2026-09-25T14:00:00Z",
  "defaultChannel": "main",
  "plugins": [
    {
      "id": "mere-frontier-handoff",
      "name": "Frontier Handoff",
      "description": "Run bounded chat or agent tasks with a user-authenticated Claude Code or Codex CLI and retain a local result receipt.",
      "repo": "https://github.com/sawfwair/mere-run-plugins",
      "package": "mere-frontier-handoff",
      "subdirectory": "packages/mere-frontier-handoff",
      "entrypoint": "mere-frontier-handoff",
      "capabilities": ["frontier-handoff", "structured-proposal", "local-agent", "durable-receipt"],
      "channels": {
        "main": {
          "manager": "pipx",
          "ref": "main",
          "spec": "git+https://github.com/sawfwair/mere-run-plugins.git@main#subdirectory=packages/mere-frontier-handoff"
        }
      }
    },
    {
      "id": "mere-searxng-search",
      "name": "SearXNG Search",
      "description": "Install and manage a local SearXNG instance, then search the web with JSON results.",
      "repo": "https://github.com/sawfwair/mere-run-plugins",
      "package": "mere-searxng-search",
      "subdirectory": "packages/mere-searxng-search",
      "entrypoint": "mere-searxng-search",
      "capabilities": ["web-search", "searxng", "json-results", "local-instance", "container-management"],
      "channels": {
        "main": {
          "manager": "pipx",
          "ref": "main",
          "spec": "git+https://github.com/sawfwair/mere-run-plugins.git@main#subdirectory=packages/mere-searxng-search"
        }
      }
    },
    {
      "id": "mere-computer-use",
      "name": "Computer Use",
      "description": "Operate one selected macOS window with a local mere.run vision model and the MIT Cua Driver CLI.",
      "repo": "https://github.com/sawfwair/mere-run-plugins",
      "package": "mere-computer-use",
      "subdirectory": "packages/mere-computer-use",
      "entrypoint": "mere-computer-use",
      "capabilities": [
        "computer-use",
        "window-scoped",
        "vision-agent",
        "accessibility",
        "local-artifact-custody"
      ],
      "channels": {
        "main": {
          "manager": "pipx",
          "ref": "main",
          "spec": "git+https://github.com/sawfwair/mere-run-plugins.git@main#subdirectory=packages/mere-computer-use",
          "setup": true
        }
      }
    },
    {
      "id": "mere-identity-tools",
      "name": "Identity Tools",
      "description": "Broker local identity curricula, text-adapter training, four-arm evaluation, and sanitized reports through a configured private backend.",
      "repo": "https://github.com/sawfwair/mere-run-plugins",
      "package": "mere-workflow-tools",
      "subdirectory": "packages/mere-workflow-tools",
      "entrypoint": "mere-identity-tools",
      "capabilities": [
        "identity-curriculum",
        "text-lora-training",
        "four-arm-evaluation",
        "sanitized-report",
        "graph-node-provider-v1",
        "local-artifact-custody"
      ],
      "channels": {
        "main": {
          "manager": "pipx",
          "ref": "main",
          "spec": "git+https://github.com/sawfwair/mere-run-plugins.git@main#subdirectory=packages/mere-workflow-tools",
          "bundles": {
            "macos-arm64": "https://mere.run/releases/plugins/mere-workflow-tools/0.4.0-3/release.json"
          }
        }
      }
    },
    {
      "id": "mere-geo-tools",
      "name": "Geospatial Tools",
      "description": "Run humanitarian geospatial candidates and Earth-observation embeddings with content-addressed raster provenance.",
      "repo": "https://github.com/sawfwair/mere-run-plugins",
      "package": "mere-geo-tools",
      "subdirectory": "packages/mere-geo-tools",
      "entrypoint": "mere-geo-tools",
      "capabilities": [
        "geospatial",
        "flood-segmentation",
        "fire-segmentation",
        "earth-observation-embeddings",
        "graph-node-provider-v1",
        "provenance"
      ],
      "channels": {
        "main": {
          "manager": "pipx",
          "ref": "main",
          "spec": "git+https://github.com/sawfwair/mere-run-plugins.git@main#subdirectory=packages/mere-geo-tools",
          "bundles": {
            "macos-arm64": "https://mere.run/releases/plugins/mere-geo-tools/0.2.0-1/envelope.json"
          }
        }
      }
    },
    {
      "id": "mere-runpod",
      "name": "RunPod Runner",
      "description": "Run canonical mere.run recipes on user-owned ephemeral RunPod pods, fetch artifacts, and terminate by default.",
      "repo": "https://github.com/sawfwair/mere-run-plugins",
      "package": "mere-runpod",
      "subdirectory": "packages/mere-runpod",
      "entrypoint": "mere-runpod",
      "capabilities": [
        "remote-runner",
        "runpod",
        "train-lora",
        "artifact-fetch",
        "cleanup"
      ],
      "channels": {
        "main": {
          "manager": "pipx",
          "ref": "main",
          "spec": "git+https://github.com/sawfwair/mere-run-plugins.git@main#subdirectory=packages/mere-runpod"
        }
      }
    },
    {
      "id": "mere-terminal-bench",
      "name": "Terminal-Bench",
      "description": "Run pinned, resource-bounded Terminal-Bench evaluations against local mere.run text models.",
      "repo": "https://github.com/sawfwair/mere-run-plugins",
      "package": "mere-terminal-bench",
      "subdirectory": "packages/mere-terminal-bench",
      "entrypoint": "mere-terminal-bench",
      "capabilities": [
        "local-evaluation",
        "terminal-bench",
        "harbor",
        "docker",
        "matched-model-comparison",
        "durable-run-manifest"
      ],
      "channels": {
        "main": {
          "manager": "pipx",
          "ref": "main",
          "spec": "git+https://github.com/sawfwair/mere-run-plugins.git@main#subdirectory=packages/mere-terminal-bench",
          "bundles": {
            "macos-arm64": "https://mere.run/releases/plugins/mere-terminal-bench/0.1.0-1/envelope.json"
          }
        }
      }
    },
    {
      "id": "mere-image-tools",
      "name": "Image Tools",
      "description": "Run local image-production tools such as subject knockout, mask export, and future dataset prep helpers.",
      "repo": "https://github.com/sawfwair/mere-run-plugins",
      "package": "mere-image-tools",
      "subdirectory": "packages/mere-image-tools",
      "entrypoint": "mere-image-tools",
      "capabilities": [
        "image-tools",
        "knockout",
        "segmentation",
        "alpha-mask",
        "sam31"
      ],
      "channels": {
        "main": {
          "manager": "pipx",
          "ref": "main",
          "spec": "git+https://github.com/sawfwair/mere-run-plugins.git@main#subdirectory=packages/mere-image-tools",
          "bundles": {
            "macos-arm64": "https://mere.run/releases/plugins/mere-image-tools/0.1.0-1/release.json"
          }
        }
      }
    },
    {
      "id": "mere-face-tools",
      "name": "Face Tools",
      "description": "Index local photo libraries and search similar faces with the native mere.run face-analysis runtime.",
      "repo": "https://github.com/sawfwair/mere-run-plugins",
      "package": "mere-face-tools",
      "subdirectory": "packages/mere-face-tools",
      "entrypoint": "mere-face-tools",
      "capabilities": [
        "face-analysis",
        "face-index",
        "face-search",
        "identity-embedding",
        "photo-library",
        "review-export",
        "sqlite"
      ],
      "channels": {
        "main": {
          "manager": "pipx",
          "ref": "main",
          "spec": "git+https://github.com/sawfwair/mere-run-plugins.git@main#subdirectory=packages/mere-face-tools",
          "bundles": {
            "macos-arm64": "https://mere.run/releases/plugins/mere-face-tools/0.1.0-1/release.json"
          }
        }
      }
    },
    {
      "id": "mere-archive-tools",
      "name": "Archive Tools",
      "description": "Build, search, and investigate a local PII-reduced shared-drive index without modifying source files.",
      "repo": "https://github.com/sawfwair/mere-run-plugins",
      "package": "mere-archive-tools",
      "subdirectory": "packages/mere-archive-tools",
      "entrypoint": "mere-archive-tools",
      "capabilities": [
        "archive-index",
        "shared-drive",
        "document-conversion",
        "captioning",
        "ocr",
        "pii-reduction",
        "multimodal-embeddings",
        "semantic-search",
        "full-text-search",
        "bounded-investigation",
        "pi-agent",
        "sqlite",
        "deduplication",
        "archive-benchmark"
      ],
      "channels": {
        "main": {
          "manager": "pipx",
          "ref": "main",
          "spec": "git+https://github.com/sawfwair/mere-run-plugins.git@main#subdirectory=packages/mere-archive-tools",
          "bundles": {
            "macos-arm64": "https://mere.run/releases/plugins/mere-archive-tools/0.1.0-2/envelope.json"
          }
        }
      }
    },
    {
      "id": "mere-vfx-tools",
      "name": "VFX Tools",
      "description": "Run local shot-oriented VFX workflows for roto, mattes, tracking, motion, native depth and geometry, and verified TripoSR or reconstruction-only InstantMesh meshes.",
      "repo": "https://github.com/sawfwair/mere-run-plugins",
      "package": "mere-vfx-tools",
      "subdirectory": "packages/mere-vfx-tools",
      "entrypoint": "mere-vfx-tools",
      "capabilities": [
        "vfx",
        "roto",
        "alpha-matte",
        "track-export",
        "keying",
        "shot-qc",
        "inbetween",
        "turntable",
        "character-sheet",
        "pose-sequence",
        "markerless-motion",
        "motion-pass",
        "optical-flow",
        "clean-plate",
        "object-removal",
        "set-extension",
        "outpainting",
        "restoration",